{
  "$schema": "https://json-schema.org/draft/2020-12/schema",
  "$id": "https://welkin.dev/schema/cloudevent.json",
  "title": "WelkinCanonicalCloudEvent",
  "type": "object",
  "required": ["id", "specversion", "type", "source", "time", "subject", "data"],
  "properties": {
    "id": { "type": "string", "minLength": 1 },
    "specversion": { "const": "1.0" },
    "type": { "type": "string", "minLength": 1 },
    "source": { "type": "string", "minLength": 1 },
    "time": { "type": "string", "minLength": 1 },
    "subject": { "type": "string", "minLength": 1 },
    "data": { "type": "object" }
  },
  "additionalProperties": true
}
